{
  "base_path": "/government/policies/employment/email-signup",
  "title": "Employment",
  "description": "",
  "format": "email_alert_signup",
  "need_ids": [],
  "locale": "en",
  "updated_at": "2015-04-14T13:11:45.809Z",
  "public_updated_at": "2015-04-14T10:56:00.000+00:00",
  "details": {
    "breadcrumbs": [
      {
        "title": "Employment",
        "link": "https://www.gov.uk/government/policies/employment"
      }
    ],
    "summary": "You'll get an email each time any information on this policy is published or updated.",
    "tags": {
      "policy": [
        "employment"
      ]
    },
    "format_type": "policy"
  },
  "links": {}
}
